[
  {
    "id": "INS-01",
    "status": "draft",
    "source_refs": [
      "S00"
    ],
    "surfaces": [
      {
        "route": "/insurance",
        "spec_path": "03-experience/screen-and-route-inventory.md",
        "role": "public visitor",
        "purpose": "Browse hierarchical products, search and availability"
      },
      {
        "route": "/insurers/:slug",
        "spec_path": "03-experience/screen-and-route-inventory.md",
        "role": "public visitor",
        "purpose": "Read approved insurer profile/plan information"
      },
      {
        "route": "/admin/catalog",
        "spec_path": "03-experience/dashboards/admin.md",
        "role": "catalog/content editor",
        "purpose": "Version category, featured-product and availability presentation"
      }
    ],
    "applicability": {
      "kind": "interactive",
      "reason": "Interactive task is presented on the listed authored route(s); action/field authorization and domain state are checked separately from dashboard entry."
    }
  },
  {
    "id": "INS-02",
    "status": "draft",
    "source_refs": [
      "S00"
    ],
    "surfaces": [
      {
        "route": "/applications/:id",
        "spec_path": "03-experience/screen-and-route-inventory.md",
        "role": "authorized applicant/customer",
        "purpose": "Complete conditional versioned fields, declarations and save/resume"
      },
      {
        "route": "/admin/catalog",
        "spec_path": "03-experience/dashboards/admin.md",
        "role": "catalog/content editor",
        "purpose": "Draft/test/publish approved form schema and localization"
      }
    ],
    "applicability": {
      "kind": "interactive",
      "reason": "Interactive task is presented on the listed authored route(s); action/field authorization and domain state are checked separately from dashboard entry."
    }
  },
  {
    "id": "INS-03",
    "status": "draft",
    "source_refs": [
      "S00"
    ],
    "surfaces": [
      {
        "route": "/account/people-and-assets",
        "spec_path": "03-experience/dashboards/customer.md",
        "role": "personal customer; authorized guardian/delegate",
        "purpose": "Manage purpose-authorized people, dependents, addresses and assets"
      },
      {
        "route": "/org/:orgId/census",
        "spec_path": "03-experience/dashboards/corporate.md",
        "role": "enrollment administrator",
        "purpose": "Manage scoped enrollment relationships without private medical disclosure"
      }
    ],
    "applicability": {
      "kind": "interactive",
      "reason": "Interactive task is presented on the listed authored route(s); action/field authorization and domain state are checked separately from dashboard entry."
    }
  },
  {
    "id": "INS-04",
    "status": "draft",
    "source_refs": [
      "S00"
    ],
    "surfaces": [
      {
        "route": "/applications/:id",
        "spec_path": "03-experience/screen-and-route-inventory.md",
        "role": "authorized applicant/customer",
        "purpose": "Request permitted insurance history/owner inquiry and review provenance/manual correction"
      },
      {
        "route": "/ops/underwriting",
        "spec_path": "03-experience/dashboards/operations.md",
        "role": "underwriting/inspection operator",
        "purpose": "Resolve inquiry failure or conflicting evidence without replacing provenance"
      }
    ],
    "applicability": {
      "kind": "interactive",
      "reason": "Interactive task is presented on the listed authored route(s); action/field authorization and domain state are checked separately from dashboard entry."
    }
  },
  {
    "id": "INS-05",
    "status": "draft",
    "source_refs": [
      "S00"
    ],
    "surfaces": [
      {
        "route": "/quotes/:id/compare",
        "spec_path": "03-experience/screen-and-route-inventory.md",
        "role": "authorized applicant/customer",
        "purpose": "Start and observe eligible carrier fan-out, partial results and expiry"
      },
      {
        "route": "/seller/quotes",
        "spec_path": "03-experience/dashboards/seller.md",
        "role": "seller",
        "purpose": "Compare assigned customer's permitted proposals"
      },
      {
        "route": "/org/:orgId/quotes",
        "spec_path": "03-experience/dashboards/corporate.md",
        "role": "requester",
        "purpose": "Review scoped commercial/group carrier offers"
      }
    ],
    "applicability": {
      "kind": "interactive",
      "reason": "Interactive task is presented on the listed authored route(s); action/field authorization and domain state are checked separately from dashboard entry."
    }
  },
  {
    "id": "INS-06",
    "status": "draft",
    "source_refs": [
      "S00"
    ],
    "surfaces": [
      {
        "route": "/quotes/:id/compare",
        "spec_path": "03-experience/screen-and-route-inventory.md",
        "role": "authorized applicant/customer",
        "purpose": "Sort/filter comparable premium, limits, deductible, exclusions and disclosed sponsorship"
      },
      {
        "route": "/org/:orgId/quotes",
        "spec_path": "03-experience/dashboards/corporate.md",
        "role": "requester; approver/checker",
        "purpose": "Compare consistent schedule/proposal revisions and negotiated deviations"
      }
    ],
    "applicability": {
      "kind": "interactive",
      "reason": "Interactive task is presented on the listed authored route(s); action/field authorization and domain state are checked separately from dashboard entry."
    }
  },
  {
    "id": "INS-07",
    "status": "draft",
    "source_refs": [
      "S00"
    ],
    "surfaces": [
      {
        "route": "/applications/:id",
        "spec_path": "03-experience/screen-and-route-inventory.md",
        "role": "authorized applicant/customer",
        "purpose": "Select contract-offered coverages/riders and resolve dependencies"
      },
      {
        "route": "/quotes/:id/compare",
        "spec_path": "03-experience/screen-and-route-inventory.md",
        "role": "authorized applicant/customer",
        "purpose": "Review coverage/pricing effects and incomparable limits"
      },
      {
        "route": "/admin/catalog",
        "spec_path": "03-experience/dashboards/admin.md",
        "role": "catalog/content editor",
        "purpose": "Version plan/rider constraints with approved carrier rules"
      }
    ],
    "applicability": {
      "kind": "interactive",
      "reason": "Interactive task is presented on the listed authored route(s); action/field authorization and domain state are checked separately from dashboard entry."
    }
  },
  {
    "id": "INS-08",
    "status": "draft",
    "source_refs": [
      "S00"
    ],
    "surfaces": [
      {
        "route": "/ops/underwriting",
        "spec_path": "03-experience/dashboards/operations.md",
        "role": "underwriting/inspection operator",
        "purpose": "Review assigned risk/evidence and record only delegated decisions"
      },
      {
        "route": "/partner/underwriting",
        "spec_path": "03-experience/dashboards/carrier.md",
        "role": "carrier underwriter",
        "purpose": "Request evidence and accept/reject within carrier authority"
      },
      {
        "route": "/applications/:id",
        "spec_path": "03-experience/screen-and-route-inventory.md",
        "role": "authorized applicant/customer",
        "purpose": "Respond to underwriting declarations/evidence requests"
      }
    ],
    "applicability": {
      "kind": "interactive",
      "reason": "Interactive task is presented on the listed authored route(s); action/field authorization and domain state are checked separately from dashboard entry."
    }
  },
  {
    "id": "INS-09",
    "status": "draft",
    "source_refs": [
      "S00"
    ],
    "surfaces": [
      {
        "route": "/inspections/:id",
        "spec_path": "03-experience/screen-and-route-inventory.md",
        "role": "authorized vehicle applicant",
        "purpose": "Book inspection, upload checklist evidence and resolve retakes"
      },
      {
        "route": "/ops/inspections",
        "spec_path": "03-experience/dashboards/operations.md",
        "role": "underwriting/inspection operator",
        "purpose": "Assign/review inspection, expiry and retake workflow"
      }
    ],
    "applicability": {
      "kind": "interactive",
      "reason": "Interactive task is presented on the listed authored route(s); action/field authorization and domain state are checked separately from dashboard entry."
    }
  },
  {
    "id": "INS-10",
    "status": "draft",
    "source_refs": [
      "S00"
    ],
    "surfaces": [
      {
        "route": "/account/quotes",
        "spec_path": "03-experience/dashboards/customer.md",
        "role": "personal customer",
        "purpose": "Save/resume and retrieve authorized quotes, expiry and reminder state"
      },
      {
        "route": "/quotes/:id/compare",
        "spec_path": "03-experience/screen-and-route-inventory.md",
        "role": "authorized applicant or scoped share recipient",
        "purpose": "Open authorized expiring quote share and revalidate before action"
      }
    ],
    "applicability": {
      "kind": "interactive",
      "reason": "Interactive task is presented on the listed authored route(s); action/field authorization and domain state are checked separately from dashboard entry."
    }
  },
  {
    "id": "INS-11",
    "status": "draft",
    "source_refs": [
      "S00"
    ],
    "surfaces": [
      {
        "route": "/insurance/:productId",
        "spec_path": "03-experience/screen-and-route-inventory.md",
        "role": "public visitor; authorized applicant",
        "purpose": "Read family-specific product terms and enter its distinct risk form"
      },
      {
        "route": "/applications/:id",
        "spec_path": "03-experience/screen-and-route-inventory.md",
        "role": "authorized applicant/customer",